<?xml version="1.0" encoding="UTF-8"?>
<?xml-stylesheet type="text/xsl" href="Final.xsl"?>
<GetModelQuestionnaireResponse xsi:schemaLocation="http://www.fortis.nl/schema/creditriskwebservices/riskassessment modelquestionnaire.xsd" xmlns="http://www.fortis.nl/schema/creditriskwebservices/riskassessment" xmlns:xsi="http://www.w3.org/2001/XMLSchema-instance">
  <ModelQuestionnaireResult>
    <ModelCode>AnotherCode</ModelCode>
    <ModelQuestionnaire id="PPRIWW06">
      <Components>
        <Component id="BR">
          <Label>
            <Text language="en">BUSINESS RISK</Text>
            <Text language="nl">BUSINESS RISK</Text>
          </Label>
          <RelevantRule refId="relevantRule1" />
          <Component id="1" xsi:type="QuestionType">
            <Label>
              <Text language="en">Credit history</Text>
              <Text language="nl">Kredietverleden</Text>
            </Label>
            <RelevantRule refId="relevantRule1" />
            <Answer xsi:type="ListAnswerType">
              <ListConstraint refId="constraintA" />
            </Answer>
            <MandatoryRule refId="relevantRule1" />
          </Component>
          <Component id="2" xsi:type="QuestionType">
            <Label>
              <Text language="en">Risk profile</Text>
              <Text language="nl">Risicoprofiel</Text>
            </Label>
            <RelevantRule refId="relevantRule1" />
            <Answer xsi:type="ListAnswerType">
              <ListConstraint refId="constraintC" />
            </Answer>
            <MandatoryRule refId="relevantRule1" />
          </Component>
          <Component id="3" xsi:type="QuestionType">
            <Label>
              <Text language="en">Source of income</Text>
              <Text language="nl">Inkomstenbron</Text>
            </Label>
            <RelevantRule refId="relevantRule1" />
            <Answer xsi:type="ListAnswerType">
              <ListConstraint refId="constraintD" />
            </Answer>
            <MandatoryRule refId="relevantRule1" />
          </Component>
        </Component>
        <Component id="FR" xsi:type="SectionType">
          <Label>
            <Text language="en">FINANCIAL RISK</Text>
          </Label>
          <RelevantRule refId="relevantRule1" />
          <Component id="FRS1" xsi:type="SectionType">
            <Label>
              <Text language="en">Assets (market value)</Text>
              <Text language="nl">Bezittingen (marktwaarde)</Text>
            </Label>
            <RelevantRule refId="relevantRule1" />
            <Component id="4" xsi:type="QuestionType">
              <Label>
                <Text language="en">Cash &amp; marketable securities</Text>
                <Text language="nl">Kassaldi &amp; verhandelbare effecten</Text>
              </Label>
              <RelevantRule refId="relevantRule1" />
              <Answer xsi:type="AmountAnswerType">
                <NumberConstraint refId="constraintAMT" />
              </Answer>
              <MandatoryRule refId="mandatoryRule1" />
            </Component>
            <Component id="5" xsi:type="QuestionType">
              <Label>
                <Text language="en">Residential real estate - owner occupied</Text>
                <Text language="nl">Residentieel onroerend goed - eigen gebruik</Text>
              </Label>
              <RelevantRule refId="relevantRule1" />
              <Answer xsi:type="AmountAnswerType">
                <NumberConstraint refId="constraintAMT" />
              </Answer>
              <MandatoryRule refId="mandatoryRule1" />
            </Component>
            <Component id="6" xsi:type="QuestionType">
              <Label>
                <Text language="en">Residential real estate - other</Text>
                <Text language="nl">Residentieel onroerend goed - overig</Text>
              </Label>
              <RelevantRule refId="relevantRule1" />
              <Answer xsi:type="AmountAnswerType">
                <NumberConstraint refId="constraintAMT" />
              </Answer>
              <MandatoryRule refId="mandatoryRule1" />
            </Component>
            <Component id="7" xsi:type="QuestionType">
              <Label>
                <Text language="en">Commercial real estate - residential real estate</Text>
                <Text language="nl">Commercieel onroerend goed - woningen</Text>
              </Label>
              <RelevantRule refId="relevantRule1" />
              <Answer xsi:type="AmountAnswerType">
                <NumberConstraint refId="constraintAMT" />
              </Answer>
              <MandatoryRule refId="mandatoryRule1" />
            </Component>
            <Component id="8" xsi:type="QuestionType">
              <Label>
                <Text language="en">Commercial real estate - retail</Text>
                <Text language="nl">Commercieel onroerend goed - retail</Text>
              </Label>
              <RelevantRule refId="relevantRule1" />
              <Answer xsi:type="AmountAnswerType">
                <NumberConstraint refId="constraintAMT" />
              </Answer>
              <MandatoryRule refId="mandatoryRule1" />
            </Component>
            <Component id="9" xsi:type="QuestionType">
              <Label>
                <Text language="en">Commercial real estate - office buildings</Text>
                <Text language="nl">Commercieel onroerend goed - kantoren</Text>
              </Label>
              <RelevantRule refId="relevantRule1" />
              <Answer xsi:type="AmountAnswerType">
                <NumberConstraint refId="constraintAMT" />
              </Answer>
              <MandatoryRule refId="mandatoryRule1" />
            </Component>
            <Component id="10" xsi:type="QuestionType">
              <Label>
                <Text language="en">Commercial real estate - other</Text>
                <Text language="nl">Commercieel onroerend goed - overig</Text>
              </Label>
              <RelevantRule refId="relevantRule1" />
              <Answer xsi:type="AmountAnswerType">
                <NumberConstraint refId="constraintAMT" />
              </Answer>
              <MandatoryRule refId="mandatoryRule1" />
            </Component>
            <Component id="11" xsi:type="QuestionType">
              <Label>
                <Text language="en">Net equity unlisted companies (controlling interest)</Text>
                <Text language="nl">Eigen vermogen niet beursgenoteerde vennootschap(pen), controlerend belang</Text>
              </Label>
              <RelevantRule refId="relevantRule1" />
              <Answer xsi:type="AmountAnswerType">
                <NumberConstraint refId="constraintAMT" />
              </Answer>
              <MandatoryRule refId="mandatoryRule1" />
            </Component>
            <Component id="12" xsi:type="QuestionType">
              <Label>
                <Text language="en">Other</Text>
                <Text language="nl">Overig</Text>
              </Label>
              <RelevantRule refId="relevantRule1" />
              <Answer xsi:type="AmountAnswerType">
                <NumberConstraint refId="constraintAMT" />
              </Answer>
              <MandatoryRule refId="mandatoryRule1" />
            </Component>
            <Component id="13" xsi:type="ResultType">
              <Label>
                <Text language="en">Total</Text>
                <Text language="nl">Total</Text>
              </Label>
              <RelevantRule refId="relevantRule1" />
              <Calculation xsi:type="AddType">
                <QuestionId>4</QuestionId>
                <QuestionId>5</QuestionId>
                <QuestionId>6</QuestionId>
                <QuestionId>7</QuestionId>
                <QuestionId>8</QuestionId>
                <QuestionId>9</QuestionId>
                <QuestionId>10</QuestionId>
                <QuestionId>11</QuestionId>
                <QuestionId>12</QuestionId>
              </Calculation>
            </Component>
          </Component>
          <Component id="FRS2" xsi:type="SectionType">
            <Label>
              <Text language="en">Liabilities (face value)</Text>
              <Text language="nl">Schulden (nominale waarde)</Text>
            </Label>
            <RelevantRule refId="relevantRule1" />
            <Component id="14" xsi:type="QuestionType">
              <Label>
                <Text language="en">Cash &amp; marketable securities</Text>
                <Text language="nl">Kassaldi &amp; verhandelbare effecten</Text>
              </Label>
              <RelevantRule refId="relevantRule1" />
              <Answer xsi:type="AmountAnswerType">
                <NumberConstraint refId="constraintAMT" />
              </Answer>
              <MandatoryRule refId="mandatoryRule1" />
            </Component>
            <Component id="15" xsi:type="QuestionType">
              <Label>
                <Text language="en">Residential real estate - owner occupied</Text>
                <Text language="nl">Residentieel onroerend goed - eigen gebruik</Text>
              </Label>
              <RelevantRule refId="relevantRule1" />
              <Answer xsi:type="AmountAnswerType">
                <NumberConstraint refId="constraintAMT" />
              </Answer>
              <MandatoryRule refId="mandatoryRule1" />
            </Component>
            <Component id="16" xsi:type="QuestionType">
              <Label>
                <Text language="en">Residential real estate - other</Text>
                <Text language="nl">Residentieel onroerend goed - overig</Text>
              </Label>
              <RelevantRule refId="relevantRule1" />
              <Answer xsi:type="AmountAnswerType">
                <NumberConstraint refId="constraintAMT" />
              </Answer>
              <MandatoryRule refId="mandatoryRule1" />
            </Component>
            <Component id="17" xsi:type="QuestionType">